name,location,description,link,price,operation,rooms,bathrooms,construction (m2),terrain (m2),estacionamientos,toilets,age
Departamento Rodeado de Naturaleza en Venta en San Jeronimo,"San Jerónimo Lídice, La Magdalena Contreras","Quedan pocos lugares en los que a donde voltees ves verde, con jardines, y fuentes para caminar, pasear a tus mascotas y simplemente disfrutar de la naturaleza, este departamento si te lo ofrece y de sobra. En una calle con acceso desde Periférico y Av. Contreras, olvídate del tráfico porque tienes los mejores accesos a todos lados, muchas opciones por donde llegar y salir ya sea a Santa Fe, Polanco, Pedregal, Coyoacán, San Ángel o hasta carreteras. Un departamento con los mejores espacios como los que ya no hacen ahora, con una estancia iluminada y enorme, cocina integral que se conecta a su vez al área de servicio. 3 recámaras con unas super vistas e iluminación, la principal con baño propio. 2 lugares de estacionamiento fijos, un fraccionamiento con mucha seguridad, jardines y árboles por todos lados. Llama ya!! Pide una cita y conócelo. Agenda tu cita al. - 55Ver datos. - 55Ver datos. Aviso de privacidad, así como quejas, sugerencias y más: No incluye el mobiliario mostrado en las fotografías. El precio es más gastos e impuestos de escrituración. EasyBroker id: eb-fy4715",/propiedades/departamento-rodeado-de-naturaleza-en-venta-en-san-59582338.html,"MN 4,690,000",venta,3.0,2.0,138.0,138.0,2.0,,
Departamento en Venta Be Grand Contadero,"Contadero, Cuajimalpa de Morelos","Departamento nuevo en venta y renta. 123m2 tiene balcón, cocina integral. cuenta con 3 recamaras, 2 baños, 2 estacionamientos, seguridad 24/7. cuenta con aménities, área de juegos infantiles, alberca, gym, jacuzzi, salón de usos múltiples renta $24, 000. 00 mnnto. Incluido. Precio $6, 300. 000. EasyBroker id: eb-kk6224",/propiedades/departamento-en-venta-be-grand-contadero-64065883.html,"MN 6,300,000",venta,3.0,2.0,123.0,123.0,2.0,,
"Departamento en Venta en Bosques de Las Lomas, Ahuehuetes Su","Bosque de las Lomas, Miguel Hidalgo","Departamento de 193 mtrs, en la mejor ubicación de bosques de las lomas, junto A la glorieta de bosques, el desarrollo tiene una casa club con alberca, gimnasio salon de fiestas, Y areas verdes. Son 2 recamaras cada una con baño Y vestidor, area de antecomedor, cocina, family Y gran estancia para sala Y comedor. Vista verde. El mantenimiento incluye el gas. EasyBroker id: eb-il8580",/propiedades/departamento-en-venta-en-bosques-de-las-lomas-62271506.html,"MN 12,500,000",venta,2.0,2.0,193.0,193.0,2.0,1.0,
Departamentos Nuevos en Venta Ciudad de Los Deportes.,"Ciudad de los Deportes, Benito Juárez","El mejor precio de la zona! Precioso condominio de solo 6 departamentos, excelente ubicación, orientación, iluminación y super comunicado. Excelentes servicios Mega Comercial Mexicana a solo 2 calles, Parque Hundido a 4 cuadras, Metro, Metrobus, Viaducto, Periférico y Circuito Interior muy fácil de tomar. Cuentan con sala/comedor, cocina equipada, area de lavado, 2 recamaras, 2 baños y 1 y 2 estacionamientos al piso Y sin estorbarse. Tenemos departamentos desde 58 hasta 92bmts2 con terrazas de hasta 30 mts, con balcones o roof garden privados y un departamento tipo loft de 58 mts2 + terraza de 10. 5 mts2.",/propiedades/departamentos-nuevos-en-venta-ciudad-de-los-deportes.-62661855.html,"MN 4,867,491",venta,2.0,2.0,88.0,100.0,2.0,,
Venta Depto Polanco Parque Lincoln,"Polanco, Miguel Hidalgo","Departamento en el corazón de Polanco a unos pasos de el parque Emilio Castelar, lleno de restaurantes, bares y tiendas. Decorado con un impecable remodelación en un edifico clásico de polanco. Cuenta con dos recamaras acad una con su baño y un baño de visitas. Cocina abierta. Sala comedor. Un estacionamiento. Vigilancia 24 horas. EasyBroker id: eb-it4161",/propiedades/venta-depto-polanco-parque-lincoln-62479625.html,"USD 750,000",venta,2.0,2.0,145.0,145.0,1.0,1.0,
Vidalta Torre Altaire II Departamento Obra Blanca a La Venta en (Mc),"Bosques de las Lomas, Cuajimalpa de Morelos","Bosques de las Lomas Residencial Vidalta Torre Altaire ii departamento en obra blanca a la venta pregunta por los diferentes metrajes Y precios (mc). Cuenta con 351 mts habitables + bodega de 9 mts + 71 mts de terraza, sala comedor amplios, 3 recámaras, 3. 5 baños, family, ventanales de piso a techo con Duovent sistema contra ruido, bodega, cuarto de lavado y servicio, elevador principal y de servicio, mant. $16, 000 mn. , 3 estacionamientos. Amenidades: alberca semi olímpica exterior, therma spa, sports &amp;amp; sushi bar, salón de adultos, restaurante, gym, alberca interior, salón de jóvenes, áreas verdes. _____________________________________________________codigo de referencia dapVer datos Las medidas son ilustrativas y deben de corroborarse con los títulos de propiedad respectivos y/o las boletas predial. Los precios publicados y la disponibilidad pueden cambiar sin previo aviso por lo que se debe de verificar con la inmobiliaria y los propietarios de los inmuebles. La publicación de la presente información no representa una oferta pública por lo que toda transacción debe de hacerse de forma personal de acuerdo a las practicas comerciales de la inmobiliaria y para poder ser valida requiere de la autorización expresa de los propietarios de los inmuebles.",/propiedades/vidalta-torre-altaire-ii-departamento-obra-blanca-a-la-64454766.html,"USD 1,175,000",venta,3.0,3.0,351.0,351.0,3.0,1.0,
"Lomas de Chapultepec, Departamento a La Venta en Monte Chimborazo, Excelente Ubicación (Gr)","Lomas de Chapultepec, Miguel Hidalgo","Lomas de Chapultepec departamento a la venta en Monte Chimborazo, excelente ubicación (gr). Cuenta con 271 mts. , estancia muy amplia con salida al balcón, mas gran terraza de 28 mts. Con asador, cocina completamente remodelada, sala de tv, 3 recámaras, 2 baños, oficina, cuarto de servicio, mantenimiento $4, 500 mn, 2 estacionamientos. Muy Iluminado y calientito. _____________________________________________________codigo de referencia dapVer datos Las medidas son ilustrativas y deben de corroborarse con los títulos de propiedad respectivos y/o las boletas predial. Los precios publicados y la disponibilidad pueden cambiar sin previo aviso por lo que se debe de verificar con la inmobiliaria y los propietarios de los inmuebles. La publicación de la presente información no representa una oferta pública por lo que toda transacción debe de hacerse de forma personal de acuerdo a las practicas comerciales de la inmobiliaria y para poder ser valida requiere de la autorización expresa de los propietarios de los inmuebles.",/propiedades/lomas-de-chapultepec-departamento-a-la-venta-en-monte-64512722.html,"MN 13,000,000",venta,3.0,2.0,271.0,299.0,2.0,,
Narvarte: Nuevo Departamento Exterior con Amplia Terraza,"Narvarte Oriente, Benito Juárez","Nuevo departamento exterior con gran terraza en condominio de sólo 4 departamentos con vigilancia y roof garden compartido. Con elevador directo llegará a la sala, cuenta con cocina integral, 3 habitaciones, 3 baños completos, 1 sala de tv así como 2 lugares de estacionamiento. Informes al Ver datos. 62 o al Ver datos. 61",/propiedades/narvarte:-nuevo-departamento-exterior-con-amplia-63905415.html,"MN 6,350,000",venta,3.0,3.0,141.0,118.0,2.0,,
Jardines de La Montaña Tlalpan Departamento en Venta o Renta,"Jardines en la Montaña, Tlalpan","120 m2. Planta Baja. Sala-comedor. Cocina integral. Área de lavandería. Cuarto y baño de servicio. 2 recámaras con opción a 3 (en venta), recámara principal con baño integrado. 2 baños completos. 2 lugares de estacionamiento techado en bateria. Bodega de 9mts2. Servicio de Valet parking. Lugares de visitas. Seguridad 24 horas. Amenidades: Jardín de niños. Jardín para mascotas. Salon de eventos. Áreas verdes. Pérgolas y área para correr. Fácil acceso a periférico e insurgentes. A pasos de plazas comerciales, supermercado, bancos, gasolinera, tintoreria, gimnasio, restaurantes. A 5 minutos de Perisur y Artz Pedregal. El precio de renta incluye mantenimiento",/propiedades/jardines-de-la-montana-tlalpan-departamento-en-venta-o-64396638.html,"MN 5,800,000",venta,3.0,2.0,120.0,120.0,2.0,,
"Espectacular Departamento, en Bosques de Las Lomas, Ultimo","Bosque de las Lomas, Miguel Hidalgo","El departamento está espectacular, de revista, con acabados divinos, calefacción hidronica, baños de mármol y pisos de madera maciza, Excelente iluminación natural ya que toda la sala tiene ventanales de piso a techo. Ubicado en zona privilegiada, Bosques de Las Lomas. El edificio cuenta con las mejores y mas completas amenidades: peluqueria, salon de yoga, salon de jovenes, salon de adultos, gym super equipado, piscina climatizada, cancha de tenis, cancha de football, fronton, ludoteca. Super vigilancia las 24 horas del día a 5 minutos de Santa Fe, Lilas, y 20 de Polanco. Muy buenos accesos a diferentes partes de la ciudad!!. EasyBroker id: eb-iz4889",/propiedades/espectacular-departamento-en-bosques-de-las-lomas-62722118.html,"MN 13,600,000",venta,3.0,3.0,305.0,305.0,3.0,,
Gran Pent House con Grandes Espacios y Roof Top,"Del Valle Norte, Benito Juárez","Vivienda de 2 habitaciones con grandes ventanas y vista a muro verde, balcon en estancia, cuenta con cocina abierta con cubierta de mármol, gran espacio de almacenamiento, cuarto de lavado independiente con lavadero y calentador instantáneo, las dos recamaras cuentan con acceso a balcón, la principal con baño completo y vestidor, la carpintería es en madera de Nogal, todo el departamento tiene pisos de mármol, igualmente los baños, canceles de vidrio, iluminación y ventilación natural en todos sus espacios, 1 estacionamiento, Tienen acceso a Roof top Privado desde el interior de el departamento, cuenta con bodega y barra, además Roof Garden de uso común totalmente equipado, vigilancia 24 horas, circuito cerrado de tv, elevador. 90m² Habitables. 8 m² balcón. 3m² Bodega. 37 m² Roof Top privado. Entrega junio 2022. Te lo vas a perder? . Contactanos, estamos encantados de ayudarte a encontrar tu próximo hogar . .",/propiedades/gran-pent-house-con-grandes-espacios-y-roof-top-63206317.html,"MN 5,744,000",venta,2.0,2.0,90.0,138.0,1.0,,
Departamento Amueblado Excelente Ubicación Condesa,"Condesa, Cuauhtémoc","Departamento en Edificio Art Decó, amueblado y equipado, Excelente ubicación en la Mejor Zona de la Colonia Condesa. Se ubica en la planta baja, mide 89 m2. Consta de: sala, comedor, cocina integral, terraza, 2 recamaras, 2 baños completos, roof garden compartido, 1 estacionamiento cubierto y elevador. Mantenimiento incluido.",/propiedades/departamento-amueblado-excelente-ubicacion-condesa-63206598.html,"MN 4,900,000",venta,2.0,2.0,89.0,,1.0,,
Departamento en Venta en Bosques de Las Lomas,"Bosques de las Lomas, Cuajimalpa de Morelos","Baja de precio! Magnifico departamento de dos niveles y excelente estado de conservación! Calle tranquila con tránsito local y ubicada a pocos pasos del Corporativo Arcos Bosques y Santa Fe. Luz natural y buenos acabados. Cuenta con amplios espacios y buena distribución. En pb se encuentra el recibidor, amplia área social con sala comedor, ante comedor, cocina equipada con barra de granito, área de lavado y cuarto de servicio. En primer nivel hay un family room al centro y las tres recamaras, cada una con closet vestidor y baño completo. El edifico tiene dos accesos; uno por Bosque de Cidros y el otro por Paseo de los Tamarindos. Además cuenta con pocos residentes, ya que son 6 departamentos en total de dos niveles cada uno. Las áreas comunes incluyen un hermoso jardín con terraza, asadores, juegos infantiles y un salón de eventos con mobiliario, cocina y baños para hombres y mujeres. No pierdas la oportunidad de conocerlo y ven ya!. EasyBroker id: eb-iq3820",/propiedades/departamento-en-venta-en-bosques-de-las-lomas-62382534.html,"MN 15,399,000",venta,3.0,3.0,382.0,382.0,3.0,1.0,
"Bosques de Las Lomas, Departamento a La Venta en Bosque de Toronjos (Ao)","Bosques de las Lomas, Cuajimalpa de Morelos","Bosques de las Lomas, departamento a la venta en Bosque de Toronjos (ao). Muy buen departamento, muy bonitas vistas a la cañada, iluminado, practica y agradable distribución. Cada recamara con baño, la principal y segunda con vestidor, tercera con closet, amplio family, piso de madera, doble despensa, antecomedor, calefacción, que no se usa porque la temperatura es muy buena, todos los baños tienen ventilación natural, Celdas solares $150 pesos pago luz, Seguridad 24 hrs. Amenidades: jardin, alberca gym, jardin para perros, salones fiestas. _____________________________________________________codigo de referencia dapVer datos Las medidas son ilustrativas y deben de corroborarse con los títulos de propiedad respectivos y/o las boletas predial. Los precios publicados y la disponibilidad pueden cambiar sin previo aviso por lo que se debe de verificar con la inmobiliaria y los propietarios de los inmuebles. La publicación de la presente información no representa una oferta pública por lo que toda transacción debe de hacerse de forma personal de acuerdo a las practicas comerciales de la inmobiliaria y para poder ser valida requiere de la autorización expresa de los propietarios de los inmuebles.",/propiedades/bosques-de-las-lomas-departamento-a-la-venta-en-64402690.html,"MN 12,800,000",venta,3.0,3.0,280.0,280.0,3.0,1.0,
Departamento en Venta en Polanco I Secc 3 Recámaras,"Polanco, Miguel Hidalgo","Este amplio departamento se encuentra ubicado en una de las calles más emblemáticas de Polanco que es Hacienda de los Morales, que es una calle de gran tradición por estar en los límites con el lugar para eventos la hacienda de los morales, que es una antigua Hacienda estilo mexicano que actualmente se usa para eventos como bodas, graduaciones, etc por sus bellos jardines e instalaciones. El departamento cuenta con 3 amplias recamaras y un amplía área social. Encuentra más propiedades en Pulppo. com",/propiedades/departamento-en-venta-en-polanco-i-secc-3-recamaras-64306809.html,"USD 729,000",venta,3.0,3.0,250.0,250.0,2.0,,
"Departamento Venta en Renta, Lafontaine, Polanco, Miguel Hi","Polanco III Sección, Miguel Hidalgo","Lujoso y luminoso departamento en edificio pequeño con mucha privacidad y tranquilidad. Elevador directamente al piso con amplia y iluminada sala y comedor con balcón perimetral. Cocina abierta con isla central, medio baño para visitas, family room con balcón. 3 recamaras, cada una con su baño, vestidor y balcón. Cuarto de servicio con su baño y cuarto de lavado. Bodega y 4 estacionamientos. Vigilancia 24horas. EasyBroker id: eb-hh7989",/propiedades/departamento-venta-en-renta-lafontaine-polanco-60980457.html,"USD 2,200,000",venta,3.0,3.0,320.0,320.0,4.0,1.0,
Departamento Exterior con Roof Garden Privado,"Del Carmen, Benito Juárez","Edificio de solo 11 departamentos, en calle arbolada y con vías de comunicación cercanas. El departamento cuenta con: 2 habitaciónes con balcón al exterior. 2 Baños completos. Sala-Comedor amplios. Cocina abierta con cubierta de granito. Cuarto de lavado. 2 estacionamientos independientes con elevaauto. Roof Garden Privado con bodega. Elevador. Roof Garden de uso común. Caseta de vigilancia. Entrega inmediata",/propiedades/departamento-exterior-con-roof-garden-privado-64376612.html,"MN 3,750,000",venta,2.0,2.0,68.0,115.0,2.0,,
Departamento en Venta en Los Manzanos 2 Recámaras,"Popotla, Miguel Hidalgo","Disfruta un departamento de 56 m2 de construcción, cuarto piso, cuenta con elevador, cisterna, balcón, estancia de sala-comedor, 2 habitaciones, 1 bañocompleto, 1 patio de servicio y 1 cajón de estacionamiento techado. El conjunto cuenta con vigilancia 24 horas. Está ubicado cerca de diferentes supermercados, plazas y cuenta con excelentes opciones a transporte público. Listo para entrega Inmediata. Encuentra más propiedades en Pulppo. com",/propiedades/departamento-en-venta-en-los-manzanos-2-recamaras-64085978.html,"MN 2,988,000",venta,2.0,,56.0,56.0,1.0,,
"Bosque de Las Lomas, Departamento a La Venta en Reforma Laureles (Gr)","Bosques de las Lomas, Cuajimalpa de Morelos","Bosque de las Lomas departamento a la venta en exclusivo Conjunto Reforma Laureles (gr). Cuenta con 420 mts, estancia amplia con vista panorámica, cocina integral, antecomedor, family, sala de t. v. , 4 recámaras cada una con baño y tres de ellas con vestidor, impecable y muy iluminado, con decoración elegante y moderna, 4 estacionamientos, bodega, cuarto de lavado y servicio, seguridad privada, mantenimiento $20, 000 pesos. Áreas comunes alberca techada y descubierta, jardín con juegos infantiles, salón de fiestas, área de asadores cancha de paddel tennis, gimnasio, ludoteca, cancha de basquetbol, área de mascotas. _____________________________________________________codigo de referencia dapVer datos Las medidas son ilustrativas y deben de corroborarse con los títulos de propiedad respectivos y/o las boletas predial. Los precios publicados y la disponibilidad pueden cambiar sin previo aviso por lo que se debe de verificar con la inmobiliaria y los propietarios de los inmuebles. La publicación de la presente información no representa una oferta pública por lo que toda transacción debe de hacerse de forma personal de acuerdo a las practicas comerciales de la inmobiliaria y para poder ser valida requiere de la autorización expresa de los propietarios de los inmuebles.",/propiedades/bosque-de-las-lomas-departamento-a-la-venta-en-64512709.html,"USD 1,250,000",venta,4.0,4.0,420.0,420.0,4.0,1.0,
Departamento Nuevo Exterior en Venta en Santa Cruz Atoyac,"Santa Cruz Atoyac, Benito Juárez","|santa cruz atoyac| Exclusivo departamento nuevo en venta, muy bien ubicado muy cerca del parque de los venados en la delegación Benito Juárez. Consta de: -2 Recámaras. -2 Baños. -1 Estacionamiento. -87. 74 mts2. -Mts2 Totales=87. 74. -Balcón Rec. Principal: 2. 51. -Balcón Rec. 2: 3. 55. -Bodega de 1. 90mts2 ubicada en el estacionamiento. -Cuarto de Servicio de 4. 25mts en la parte de arriba del edificio. Roof Garden público con asador. No dejes que te lo ganen, Agenda tu cita hoy mismo! Precio de inversión. $4'050, 000. EasyBroker id: eb-iw7679",/propiedades/departamento-nuevo-exterior-en-venta-en-santa-cruz-62610282.html,"MN 4,050,000",venta,2.0,2.0,87.0,87.0,1.0,,
"Departamento en San Pedro de Los Pinos, Benito Juárez","San Pedro de los Pinos, Benito Juárez","Disfruta un departamento muy acogedor de 78. 08 m2 de construcción, sexto piso, cuenta con cisterna, elevador, estancia de sala-comedor, 3 habitaciones, 2 baños completos, 2 cajones de estacionamiento, salón de usos múltiples, gimnasio, roof garden y vigilancia 24 hrs. Está ubicado cerca de diferentes supermercados, plazas y cuenta con excelentes opciones a transporte público. Listo para entrega Inmediata. Encuentra más propiedades en Pulppo. com",/propiedades/departamento-en-san-pedro-de-los-pinos-benito-juarez-64162144.html,"MN 3,540,000",venta,3.0,2.0,78.0,78.0,2.0,,
Moderno Departamento con Gran Distribución,"Del Valle Sur, Benito Juárez","Ubicado en Av. Coyoacán a unos pasos del Sanborns Café Parroquia, a 2 calles del Parque Pascual Ortiz Rubio y entre Galerías Insurgentes y Plaza/Patio Universidad. Edificio de 14 departamentos, amplia recepción con caseta de vigilancia y baño propio. Ubicado en primer piso. - Sala comedor con acceso a Balcón. - Cocina con amplia barra de granito y acceso a cuarto de lavado. - 2 recámaras, la principal con baño completo. - 2 baños completos en total. - 2 cajones de estacionamiento con eleva auto. - Roof Garden Privado. Elevador. * Bodegas disponibles con precio extra. Interesados contactar en día y horario abierto",/propiedades/moderno-departamento-con-gran-distribucion-64288489.html,"MN 5,150,000",venta,2.0,20.0,70.0,91.0,2.0,,
Venta Pent House en Cuajimalpa Inmediato a Contadero,"Cuajimalpa, Cuajimalpa de Morelos","Magnifico penthouse con roof garden privado cuajimalpa! A estrenar. -50- Moderno, acabados de buena calidad, muy iluminado, amplio y cómodo. Consta de los siguientes espacios: Sala, comedor, cocina integral, despensa, 2 recámaras, la principal con vestidor, 2 baños, área de lavandería, 2 lugares de estacionamiento cubierto. Más Roof Garden Privado. Áreas comunes: Gimnasio, salón de usos múltiples, jardín con asadores, jardín de niños. Elevador, Vigilancia 24 horas. Mantenimiento $1, 800. 00 pesosUbicado a 5 minutos de Contadero, a 15 minutos de Santa Fe y Lomas de Vista Hermosa, inmediato a la Carretera México -Toluca. Con la opción de adquirir sin Roof Garden Privado por $5'000, 000. 00 M. N. Gánalo y vívelo! (msa) denh23Ver datosMVer datoseb-hd5606",/propiedades/venta-pent-house-en-cuajimalpa-inmediato-a-contadero-64550857.html,"MN 6,300,000",venta,2.0,2.0,97.0,97.0,2.0,,
Departamento Santa Maria La Ribera,"Santa María la Ribera, Cuauhtémoc","Excelente departamento recien remodelado, cuenta con tres recamaras, dos baños completos, sala comedor, cocina, area de lavado, jaula de tendido, un lugar de estacionamiento, puerta electrica, elevador, circuito cerrado, muy bien iluminado, cerca de avenidas principales como Circuito Interior, Antonio Alzate, Insurgentes, Av Mexico - Tacuba, gran oportunidad.",/propiedades/departamento-santa-maria-la-ribera-63787124.html,"MN 3,190,000",venta,3.0,2.0,105.0,105.0,1.0,,
"Plutarco Elias Calles 999,pent - House 503","Portales Norte, Benito Juárez","Estilo, Tranquilidad, en una de las mejores zonas de portales, 30 exclusivos departamentos, 5 niveles con 6 departamentos por piso, departamento de 67. 8m2 con un Roof Garden Privado 38. 9m2. 2 recamaras, vestidor en recamara principal con baño completo, total 2 baños en el departamento, sala, comedor, cocina equipada, cuarto de lavado, elevador, área común, 2 lugares de estacionamiento, vigilancia 24hrs.",/propiedades/plutarco-elias-calles-999-pent-house-503-62882114.html,"MN 3,762,991",venta,2.0,2.0,68.0,,2.0,,
Excelente Departamento con Terraza en Venta en Vidalta en,"Lomas del Chamizal, Cuajimalpa de Morelos","Termina a tu gusto excelente departamento en obra negra con terraza donde disfrutarás de una hermosa vista. Son 250 mts + 15 mts de terraza + 9 mts de bodega. Cuenta con 3 lugares de estacionamiento. Espectaculares áreas comunes: jardines, alberca al aire libre, alberca techada, alberca terapéutica, gimnasio con salones para clases, increíbles spa catalogado como uno de los mejores de la ciudad, juegos infantiles, ludoteca, restaurantes, asadores, salones de fiestas, entre otras. Cuenta con estricta seguridad 24 hrs. Y valet parking. EasyBroker id: eb-it0986",/propiedades/excelente-departamento-con-terraza-en-venta-en-vidalta-62469942.html,"USD 820,000",venta,,,265.0,265.0,3.0,,
Hermoso Departamento con Excelentes Acabados,"Condesa, Cuauhtémoc","Hermoso departamento en una de las colonias mas destacadas y céntricas de la ciudad de México: La Condesa, con toda la atracción de la colonia muy cerca del desarrollo. 3 recamaras. La principal con baño completo. Sala comedor. Cocina. Área de lavado. 2 baños completos. 2 estacionamientos. El desarrollo cuenta con Gimnasio, sala de usos múltiples, alberca, seguridad las 24 horas",/propiedades/hermoso-departamento-con-excelentes-acabados-64151700.html,"MN 6,909,000",venta,3.0,2.0,90.0,90.0,2.0,,
Departamento con Acabados de Lujo y Amplios Espacios,"Del Valle Centro, Benito Juárez","Cuidamos al máximo todos los espacios creando ambientes abiertos, muy iluminados y con excelente ventilación y acabados de lujo. Nuestros espacios: - Sala comedor con gran balcón exterior con vista al parque de Nápoles. - Cocina integral con cubierta de quarzo equipada con: Parrilla, horno, lavavajillas, campana, microondas y tarja de la marca Teka. - Sala de televisión con closet de blancos y baño de vistas con ventilación natural u opción a 3ra recámara o Estudio. - Habitación secundaria con amplios closets, baño privado con ventilación natural. - Habitación principal con vestidor walk-in, baño con ventilación natural y terraza privada. - Cuarto de lavado. - Cocina integral abierta con barra de desayuno. - Área de servicio al interior. - Bodegas disponibles. - 1 Cajon de Estacionamiento. - Caseta de vigilancia. - Estructura de acero y varillas reforzadas. Construido bajo las normas de seguridad anti sísmicas posteriores al sismo del 2017. Interesados contactar en día y horario abierto",/propiedades/departamento-con-acabados-de-lujo-y-amplios-espacios-63909691.html,"MN 4,500,000",venta,2.0,2.0,81.0,81.0,1.0,1.0,
Plaza Carso 1 Recamara,"Ampliación Granada, Miguel Hidalgo","Exclusivo departamento de lujo en Residencial Plaza Carso ii con excelente orientación, finos acabados en madera, mármol, granito y cerámico, cuenta con amplia estancia, cocina integral con barra de granito abierta, muy iluminado, 70m2 1 recamara, 1 baño, 1 estacionamiento, walk in closet y area de lavado. Amenidades: Alberca, Gimnasio, salón de fiestas, ludoteca, salón de adultos, jardines, Cancha de Paddel. Estricta Vigilancia 24 horas, inmediato a importantes corporativos como Nestlé, Colgate, Tetra Pack, Philip Morris, Telcel a unas cuadras de Polanco, Lomas de Chapultepec y los mejores Centros Comerciales y Corporativos. Acceso directo a supermercados, cines, las mejores tiendas y restaurantes. La zona es muy segura, ideal para ejecutivos y expatriados",/propiedades/plaza-carso-1-recamara-51258969.html,"MN 23,000",venta,1.0,,70.0,70.0,2.0,,
