name,location,description,link,price,operation,rooms,bathrooms,construction (m2),terrain (m2),estacionamientos,toilets,age
Departamento en Venta en Plaza Carso: 2 Recamaras con Family o Tercera Recamara,"Ampliación Granada, Miguel Hidalgo","Precioso departamento de 121 M2; esquinero, 2 recamaras, Y family room O tercera recamara. 2 baños completos. Baño de visitas. Area de lavado. Amplio salon comedor. Preciosa cocina abierta. Muy luminoso. Acabados de primera calidad. 2 cajones de estacionamiento. Completo conjunto de amenidades. Vigilancia 24 horas. Estacionamiento para visitas. Acceso directo al centro comercial. Las vistas y la orientación pueden variar.",/propiedades/departamento-en-venta-en-plaza-carso:-2-recamaras-con-56405877.html,"MN 8,900,000",venta,3.0,2.0,121.0,121.0,2.0,1.0,
Departamento en Venta en Santa Fe Cuajimalpa,"Santa Fe Cuajimalpa, Cuajimalpa de Morelos","Departamento en Venta en Santa Fe. Departamento en Venta en Rayo Vende Inmobiliaria. Tu hogar en una ubicación privilegiada. Excelente departamento en Gran Santa Fé de 238m. Muy iluminado piso 14 con vista panorámica a centro comercial, restaurantes y parque La Mexicana. • 3 recámaras con baño, la principal con vestidor. • Pisos de madera con excelentes acabados. • Family. • Cuarto de servicio. • 3 estacionamientos. • Bodega. • Amenidades: alberca, gimnasio, salón de fiestas, salón de jóvenes y de adultos, jardín y juegos infantiles. renta + $6, 500. - mto. ¡Listo para estrenar departamento con Rayo Vende Inmobiliaria! ¡Hazlo tuyo, invierte y estrena!, tenemos más de 40 años de experiencia, te asesoramos en todo el proceso de compra con Seguridad, Honestidad y Transparencia. ¡Contáctanos hoy mismo! (55) Ver datos. Ver datos. EasyBroker id: eb-fh8411",/propiedades/departamento-en-venta-en-santa-fe-cuajimalpa-62515201.html,"MN 14,500,000",venta,3.0,3.0,238.0,238.0,3.0,1.0,
Lomas de Chapultepec con Balcon y Vista Arbolada Departamento en Venta,"Lomas de Chapultepec, Miguel Hidalgo","Estancia. Sala - comedor integrado a balcon con vista arbolada. Baño de visitas. Cocina integral. Área de lavandería con ventilación natural, baño y cuarto de servicio. 3 recamaras, principal con vestidor y baño integrado, secundarias comparten baño. 1 lugar de estacionamiento. Bodega, azotea con área de lavandería y tendido. Portero y seguridad 24 horas",/propiedades/lomas-de-chapultepec-con-balcon-y-vista-arbolada-61206523.html,"MN 7,200,000",venta,3.0,2.0,132.0,132.0,1.0,1.0,
"Plutarco Elias Calles 999,pent - House 503","Portales Norte, Benito Juárez","Estilo, Tranquilidad, en una de las mejores zonas de portales, 30 exclusivos departamentos, 5 niveles con 6 departamentos por piso, departamento de 67. 8m2 con un Roof Garden Privado 38. 9m2. 2 recamaras, vestidor en recamara principal con baño completo, total 2 baños en el departamento, sala, comedor, cocina equipada, cuarto de lavado, elevador, área común, 2 lugares de estacionamiento, vigilancia 24hrs.",/propiedades/plutarco-elias-calles-999-pent-house-503-62882114.html,"MN 3,762,991",venta,2.0,2.0,68.0,,2.0,,
"Magnífico Garden House en Venta en Residencial Las Flores, C","Contadero, Cuajimalpa de Morelos","Magnífíco garden house muy iluminado en excelente ubicación en el residencial Las Flores Contadero, con acabados de lujo, pisos de mármol y madera. Son 312 m habitables con 3 recámaras, 3. 5 baños, amplia sala y comedor, cocina integral, sala de tv, chimenea, jardín, 4 terrazas, 6 lugares de estacionamiento, cuarto de servicio y lavado, bodega. Cuenta con vigilancia 24 horas. EasyBroker id: eb-iw2293",/propiedades/magnifico-garden-house-en-venta-en-residencial-las-62591566.html,"MN 17,000,000",venta,3.0,3.0,311.0,311.0,6.0,1.0,
Plaza Carso 3 Recamaras y Cuarto de Servicio,"Ampliación Granada, Miguel Hidalgo","Muy exclusivo ubicado en Residencial Plaza Carso, Hermoso Departamento con una superficie de 170 metros, de Super Lujo, inmediato a Polanco, Antara, Periférico, Ejercito Nacional, Río San Joaquin, Reforma, Circuito Interior, Lomas de Chapultepec, los mejores Centros Comerciales y Corporativos, Estilo Contemporáneo, precioso departamento, excelente orientación, vista panoramica al Museo Soumaya, muy iluminado, lleno de luz, acabados de super lujo, mármol, granito y cerámica, fina carpinteria italiana, cuenta con amplia estancia, cocina integral con barra de granito abierta, muy iluminado, hermosa vista panoramica, 03 recamaras, 03 1/2 baños, Sala de television o estudio, 03 estacionamientos, closets empotrados, Cuarto de Servicio con baño integrado, Cuarto de Lavado. Amenidades: Alberca, Gimnasio, salón de fiestas, ludoteca. Estricta Vigilancia 24 horas. Cerca de supermercados, cines, las mejores tiendas y restaurantes. Todo! Vealo! Especial para ejecutivos o extranjeros. Excelente zona, céntrica y con acceso a múltiples servicios, comercios, entretenimiento y vías rápidas, acceso controlado. Excelente ubicación inmediato al restaurantes con acceso a múltiples servicios, comercios y lugares públicos, asi como a una gran oferta cultural, caminando o en auto. Todos los servicios a la mano. A menos de 10 minutos (caminando): cafés, teatros, cines, club deportivo, farmacias, restaurante/bar, bancos, gasolinera, vigilancia, spa, salones y peluquerías, regalos, agencias automotrices, etc. Cerca de Corporativos, las mejores escuelas y Universidades. Una de las zonas con mayor tradición, historia y plusvalía de la Ciudad de México, segura, y con excelentes opciones para pasear y disfrutar con la familia o amigos.",/propiedades/plaza-carso-3-recamaras-y-cuarto-de-servicio-54915187.html,"MN 40,000",venta,3.0,3.0,170.0,170.0,3.0,1.0,
Espectacular Departamento con Terraza y Acabados de Lujo Sin,"Polanco, Miguel Hidalgo","Espectacular Departamento de dos pisos, con acabados de lujo. Primer Piso. Sala (Doble Altura) Comedor. Cocina amplia y Equipada. Barra de Vinos, Con instalaciones para audio y Televisión. Terraza amplia de 47 m2. Cuarto de Lavado. Cuarto de servicio. Segundo Piso. 2 Recámaras. La principal con baño con acabados de lujo, vestidor y balcón a la calle. Family con clóset de blancos y baño completo. Segunda recámara con Baño y vestidor. Persianas eléctricas. Circuito cerrado en el Edificio. Gimnasio. 2 Cajones de Estacionamiento Asignados. (Se estorban entre ellos) Vigilancia las 24 hrs. EasyBroker id: eb-gz6224",/propiedades/espectacular-departamento-con-terraza-y-acabados-de-60659945.html,"MN 32,000,000",venta,2.0,4.0,200.0,200.0,2.0,1.0,
Departamento en Preventa en Escandón,"Escandón I Sección, Miguel Hidalgo","Exclusivo edificio diseñado con un estilo moderno y sofisticado. El desarrollo consta de 3 niveles con 12 departamentos. Cuenta con un área de uso común con jardín y terraza, elevador y. vigilancia. El Departamento 304 cuenta con: 2 recámaras. Clósets. Cocina. Comedor. Sala. Estudio. 2 baños. Área de lavado. Jardín privado/balcón. /roof garden. -fecha de entrega: febrero 2022. precio de inversión: $8, 706, 900. ""Todo pago, depósito y/o cheque en garantía que se emita para realizar el apartado o pago respecto de cualquier inmueble, deberá realizarse única y exclusivamente en las cuentas bancarias de los propietarios. Ninguna inmobiliaria externa podrá recibir en sus cuentas y/o de terceros ningún pago, depósito y o cheque en garantía de ningún tipo. La vigencia de la aceptación de las propuestas tendrán una vigencia únicamente de 10 días naturales”. EasyBroker id: eb-iw1691",/propiedades/departamento-en-preventa-en-escandon-62589582.html,"MN 10,737,000",venta,2.0,2.0,240.0,240.0,2.0,,
Se Vende Penthouse en Condesa (A 1 Cuadra de Parque España),"Condesa, Cuauhtémoc","Vive en el corazón de la Condesa, ubicación inmejorable, Pent House estilo Loft Neoyorkino, rodeado totalmente de balcones y terrazas con vistas arboladas: -305m2 de superficie total. -Doble altura. - Recamara principal con vestidor y baño completo (abierta estilo loft) -Recámara secundaria cuenta con baño completo. -Estudio (opción a 3ra recámara, no tiene baño propio) - Cocina abierta y amplia. -Primer nivel se encuentra rodeado de balcones con vistas arboladas. -La recámara principal estilo loft tiene terraza privada. - Elevador exclusivo del ph. - 2 Lugares de estacionamiento techados. -Vigilancia 24 horas. - Roof Garden Exclusivo del ph. -mira el video de la propiedad en multimedia del anuncio-- Edificio de sólo 4 departamentos, diseño vanguardista, a solo 1 cuadra de Parque España, super céntrico y con excelente ubicación. Único en su tipo, construido por el afamado arquitecto Javier Sanchez.",/propiedades/se-vende-penthouse-en-condesa-a-1-cuadra-de-parque-62789782.html,"MN 26,500,000",venta,,2.0,175.0,305.0,2.0,1.0,
"Polanco, Excelente Departamento a La Venta en Lafontaine (Vm)","Polanco, Miguel Hidalgo","Polanco, excelente departamento a la venta en Lafontaine (vm) Cuenta con 150mts. Habitables más 22mts. De terraza, estancia amplia, 2 recamaras, 2. 5 baños, mantenimiento $8000 pesos mensuales, 2 lugares de estacionamiento, bodega. Estupenda ubicación, perfecto estado de conservación. _____________________________________________________codigo de referencia dapVer datos Las medidas son ilustrativas y deben de corroborarse con los títulos de propiedad respectivos y/o las boletas predial. Los precios publicados y la disponibilidad pueden cambiar sin previo aviso por lo que se debe de verificar con la inmobiliaria y los propietarios de los inmuebles. La publicación de la presente información no representa una oferta pública por lo que toda transacción debe de hacerse de forma personal de acuerdo a las practicas comerciales de la inmobiliaria y para poder ser valida requiere de la autorización expresa de los propietarios de los inmuebles.",/propiedades/polanco-excelente-departamento-a-la-venta-en-64454775.html,"MN 18,000,000",venta,2.0,2.0,150.0,172.0,2.0,1.0,
"Polanco, Departamento Th 103, a La Venta en Obra Gris en Goldsmith 222 (Js/vm)","Polanco, Miguel Hidalgo","Polanco, Goldsmith 222, Departamento tipo Town House, desarrollado en 2 plantas, cuenta con 159m, mas una terraza de 24m. Consta de 3 recamaras, 2 cuentan con baño y vestidor, la tercera con baño y closet. Distribucion: Planta alta: acceso principal, sala, comedor, cocina abierta, medio baño de visitas, área de lavado y cuarto de servicio con baño. Planta Baja: 3 recamaras. 2 estacionamientos. _____________________________________________________codigo de referencia dapVer datos Las medidas son ilustrativas y deben de corroborarse con los títulos de propiedad respectivos y/o las boletas predial. Los precios publicados y la disponibilidad pueden cambiar sin previo aviso por lo que se debe de verificar con la inmobiliaria y los propietarios de los inmuebles. La publicación de la presente información no representa una oferta pública por lo que toda transacción debe de hacerse de forma personal de acuerdo a las practicas comerciales de la inmobiliaria y para poder ser valida requiere de la autorización expresa de los propietarios de los inmuebles.",/propiedades/polanco-departamento-th-103-a-la-venta-en-obra-gris-64290838.html,"USD 792,157",venta,3.0,3.0,183.0,183.0,2.0,1.0,
Departamento en Venta en del Valle,"Del Valle Centro, Benito Juárez","Departamento en Venta en del Valle. Departamento en Venta en Rayo Vende Inmobiliaria. Tu mejor inversión está en del Valle. Único ph estilo town house de 488 metros, elevador al piso, techos de gran altura, excelente distribución, acabados de ultra lujo, pisos brasileños de granito, paredes con placas de mármol italiano y brasileño. Magnífica ubicación. • 4 recámaras. • 3 baños completos. • Master suite con baño y vestidor enorme. • Estancia muy amplia e iluminada. • Cocina integrada en mármol de una sola pieza. • Roof garden precioso con cuarto de juegos. • Sala tv. • Bocinas ocultas. • Asador argentino y horno italiano de piedra. • Cava 400 vinos. • Baños para hombres y mujeres. • Barra de granito tipo bar con instalaciones de restaurante. • Jardinería que envuelve ambiente único en el roof garden que permite disfrutar de atardeceres fantásticos. • Cuarto de servicio con baño. • Bodega muy amplia. • Cuarto de lavado con baño. • 3 lugares de estacionamiento. • Sólo 4 departamentos en todo el edificio. ¡precio negociable! ¡Listo para estrenar departamento con Rayo Vende Inmobiliaria! ¡Hazlo tuyo, invierte y estrena!, tenemos más de 40 años de experiencia, te asesoramos en todo el proceso de compra con Seguridad, Honestidad y Transparencia. ¡Contáctanos hoy mismo! (55) Ver datos. Ver datos. EasyBroker id: eb-hw4738",/propiedades/departamento-en-venta-en-del-valle-62515735.html,"MN 19,800,000",venta,4.0,2.0,400.0,400.0,3.0,,
Hermosos Departamentos en Venta Frente Al Parque Mariscal Sucre Col. del Valle.,"Del Valle Centro, Benito Juárez","Desarrollo de solo 10 departamentos frente al Parque Mariscal Sucre, cuentan con roof garden común, elevador y la vista, orientación e iluminación son de 71 y 80 mts2 que constan de sala/comedor, cocina equipada, area de lavado, 2 recamaras, 1 y 2 baños y 1 y 2 estacionamientos. Cuenta con muy buenas vais de comunicación y servicios. Los estacionamientos son al piso y solo 1 departamento se estorba. Entrega Marzo 2022.",/propiedades/hermosos-departamentos-en-venta-frente-al-parque-63040702.html,"MN 4,030,000",venta,2.0,2.0,69.0,72.0,1.0,,
Venta Departamento en Merced Gómez 2 Recámaras,"Delegación Política Benito Juárez, Benito Juárez","Propiedad certificada con acabados de lujo a precio competitivo. Departamento en Tiburcio Sánchez de la Barquera, Merced Gómez, Benito Juárez. Cuenta con una superficie de construcción de 76. 22 m2. La propiedad tiene excelente iluminación y distribución de espacios, sala, comedor, cocina integral, 2 recámaras, 1 baño y 9. 26 m2 de terraza. Cerca de la zona encontrarás áreas verdes, así como restaurantes, centros comerciales y medios de transporte. El precio que aquí se muestra puede ser cambiado sin previo aviso e incluye proyecto de remodelación. Las imágenes que se muestran son de carácter ilustrativo, contenido real en proceso. Encuentra más propiedades en Pulppo. com",/propiedades/venta-departamento-en-merced-gomez-2-recamaras-64107189.html,"MN 3,200,000",venta,2.0,,76.0,76.0,,,
Departamento Exterior con Amplios Espacios y Terraza de 32 m&sup2;,"Polanco IV Sección, Miguel Hidalgo","Estrene espectacular Garden House en Alejandro Dumas Polanco, calle súper amplia y tranquila, con fácil acceso tanto vehicular como peatonal a la mejor zona del país. Cuenta con acabados de súper lujo, mármol cantera, madera de ingeniería y mucho más. -Mascotas Pequeñas y medianas- seguridad. portón electrico. interesados contactar en dia Y horario abierto",/propiedades/departamento-exterior-con-amplios-espacios-y-terraza-64448040.html,"MN 15,900,000",venta,2.0,2.0,157.0,157.0,2.0,,
Departamento con Perfecta Iluminación y Amplios Espacios,"Zacahuitzco, Benito Juárez","Bengala. Bengala está situado en Benito Juárez, en el corazón de una área que prospera día con día y dota a sus habitantes de una gran calidad de vida. Es el lugar ideal para cualquier persona que busque un espacio de relajación donde también pueda divertirse. Con más de 2 unidades disponibles, los residentes pueden elegir entre varios espacios diseñados con las últimas tendencias, habitaciones que se ajustan a las necesidades de cada familia. Bengala ofrece viviendas con 2 Recámaras habitaciones que podrás distribuir como desees para tu mayor comodidad. Aunado a ello, cualquier habitación, ya sea dormitorio, sala o comedor, se convertirá en tu favorita por la fascinante vista de Benito Juárez que tendrás. Una forma alternativa y única de disfrutar de la tranquilidad de tu hogar. Una vez que te hayas decidido por Bengala ten la seguridad de que los acabados de paredes, pisos y techos serán de la mejor calidad, ya que todos están respaldados por estudios arquitectónicos especializados. Bengala sabe lo importante que es cada parte de tu nuevo hogar por ello la sala de estar, cocina, comedor, dormitorios y baños tendrán un toque especial, elevador, todo con tal de garantizar una experiencia de vida completa. Interesados contactar en dia Y horario abierto. nota-esta sujeto a cambio de precio sin previo aviso-",/propiedades/departamento-con-perfecta-iluminacion-y-amplios-64141972.html,"MN 3,127,359",venta,2.0,2.0,63.0,63.0,1.0,,
Plaza Carso 3 Recamaras,"Ampliación Granada, Miguel Hidalgo","Muy exclusivo ubicado en Residencial Plaza Carso Polanco, inmediato a Polanco, Periférico, Ejercito Nacional, Circuito Interior, Lomas de Chapultepec, los mejores Centros Comerciales y Corporativos, Estilo Contemporáneo impecable, precioso departamento, finos acabados en madera, mármol, granito y cerámico, cocina integral abierta con barra de granito, muy iluminado, hermosa vista y orientación, amplia estancia y cocina integral abierta, 03 recamaras, 02 baños, 02 estacionamientos, closets empotrados, Cuarto de Lavado. Acceso Directo a Plaza Carso Centro comercial y City Market. Amenidades: alberca, gimnasio, salón de fiestas, ludoteca, canchas de tenis, area de mascotas, jardines con juegos infantiles y acceso al centro comercial Plaza Carso. Vigilancia estricta las 24 horas. Cerca de Antara, supermercados, cines, las mejores tiendas y restaurantes. Todo! Especial para expatriados, ejecutivos y familias",/propiedades/plaza-carso-3-recamaras-50521171.html,"MN 35,000",venta,3.0,2.0,118.0,118.0,2.0,1.0,
Impecable Departamento en Narvarte Oriente,"Narvarte Oriente, Benito Juárez","Se vende departamento Narvarte Oriente, 4 recámaras, 3 baños completos, dos lugares de estacionamiento, cuarto piso sin elevador. Edificio de 40 años de antigüedad.",/propiedades/impecable-departamento-en-narvarte-oriente-64307586.html,"MN 4,600,000",venta,4.0,3.0,168.0,168.0,2.0,,
Departamento en Venta en Recidencial Via Santa Fe,"Santa Fe Cuajimalpa, Cuajimalpa de Morelos","Departamento en venta Residencial vía santa fe. Precio 5, 500, 000 mn. El departamento tiene un metraje de 105 m2 se ubica en torre 2 interior 15 el departamento cuenta con 2 recamaras, 2 baños completos, sala comedor, cocina, área de lavado, 2 cajones de estacionamiento y bodega. Áreas comunes: gimnasio, ludoteca, jardín con juegos infantiles y salón de asadores, salón de fiestas con cocina, baños y jardín. También cuenta con servicio de transporte por las áreas de Santa Fe. Direccion: Prolongacion Paseo de la Reforma 355 interior 1503 residencial vía santa fe torre 2. Cp Ver datos. Mantenimiento 3, 700 incluye agua y gas. Janet Díaz García. Cel: Ver datos. Mail: Ver datos. EasyBroker id: eb-kr4229",/propiedades/departamento-en-venta-en-recidencial-via-santa-fe-64309366.html,"MN 5,500,000",venta,2.0,2.0,105.0,105.0,2.0,1.0,
Departamento en Venta en Bosques de Las Lomas,"Bosques de las Lomas, Cuajimalpa de Morelos","En torre alerces, con vista A puro verde Y montañas, con la ventaja que el estacionamiento llega directo al departamento como si fuera casa, sin necesidad de tomar el elevador. Son 330 mtrs habitables, marmol de piezas grandes en todo el area social Y en recamaras Y estudio madera. La sala Y comedor es una escuadra de puro cristal Y en esa misma area esta el family room Y el baño de visitas. Cocina muy iluminada, buena area de lavado Y buen cuarto de servicio. Las 2 recamaras de los niños tiene cada una su vestidor Y baño Y en medio de ambas esta un estudio de muy buen tamaño, la rec principal es enorme, con un gran baño Y excelente vestidor. Todas las alturas son muy impresionantes, cabe mencionar que cuenta con calefaccion hidrionica Y todo son focos de led. 3 lugares de estacionamiento Y bodega. Muy lindas areas comunes, alberca semi olimpica, gimnasio con instructor incluido, jardin, ludoteca, salon de adultos Y salon de fiestas. EasyBroker id: eb-jw5818",/propiedades/departamento-en-venta-en-bosques-de-las-lomas-63565092.html,"MN 11,995,000",venta,3.0,3.0,330.0,330.0,3.0,1.0,
Departamento en Venta Club de Golf Bosques,"Lomas de Vista Hermosa, Cuajimalpa de Morelos","Exclusivo y hermoso departamento en venta en una una de las mejores zonas de la cdmx para vivir, con alta plusvalía y seguridad, ubicado a unos minutos de centros comerciales, restaurantes, hospitales, colegios, parques y más. El departamento cuenta con acabados de lujo, iluminación natural, amplios espacios, hermosa vistas al club de golf en todas las área de la casa, amplios espacios con 390 mts habitables en un piso 10, con solo 2 departamentos por piso, distribuidos de la siguiente manera, 3 recámaras la principal con baño y vestidor, las 3 son muy amplias y cuentan con baño y terraza privada cada una, amplia estancia y family el cual puede si así se requiere convertir en una 4ta. Recámara, las cuales también cuentan con terrazas amplias y vistas espectaculares, amplia cocina, cto de lavado y de servicio con baño, 6 cajones de estacionamiento techados y 2 bodegas. El precio incluye la acción del club de golf el cual cuenta con todas las amenidades requeridas para sus momentos de esparcimiento familiar. Circuito cerrado y vigilancia 24/7. EasyBroker id: eb-jr4543",/propiedades/departamento-en-venta-club-de-golf-bosques-63389834.html,"USD 2,000,000",venta,3.0,3.0,390.0,390.0,6.0,1.0,
Vendo Departamento Bosques de Las Lomas Abetos 101,"Bosques de las Lomas, Cuajimalpa de Morelos","Estudio. inmobiliario ofrece departamento en venta Bosques de las Lomas, seguridad, dos departamentos por piso, dos elevadores principal y de servicio. Excelente estado de conservación, soleado, luminoso, amplia estancia comedor, amplia cocina, tres recamaras, recamara principal con vestidor y baño, un baño se conecta para dos recamaras, medio baño de visitas, lavandería y cuarto de servicio con baño. Dos lugares de estacionamiento independientes. Areas Comunes: jardín con juegos infantiles, gimnasio y alberca techada, sala de cine, salón de fiestas, ludoteca, seguridad privada 24 hrs, monitores y cámara de seguridad. Elevador directo al Superama y centro comercial a media cuadra. Pet friendly. Mantenimiento $7, 000",/propiedades/vendo-departamento-bosques-de-las-lomas-abetos-101-63031908.html,"MN 11,500,000",venta,3.0,2.0,192.0,,2.0,1.0,
Departamento en Venta en Bosques de Las Lomas (Tecamachalco),"Bosques de las Lomas, Cuajimalpa de Morelos","Espectacular departamento en Residencial Gardenias muy iluminado con acabados de lujo y una excelente vista panorámica. Muy amplios espacios y muy buena ubicación. Consta de tres recámaras con vestidor y baño. 285m2. Estancia con muy buen espacio y closets empotrados. Tiene tres baños y medio y tres estacionamientos. Tiene oficina, family cocina integral lavandería cuarto de servicio con baño completo. El edificio cuneta con tres torres y Valet Parking para visitas. Áreas comunes: spa recién remodelado. Ludoteca. Gym. Alberca techada. Asadores. Salón de Fiestas. Cancha de squash. Mantenimiento $10, 400, 00 pesos al mes. EasyBroker id: eb-jo7277",/propiedades/departamento-en-venta-en-bosques-de-las-lomas-63448438.html,"MN 12,800,000",venta,3.0,3.0,285.0,285.0,3.0,1.0,
Departamento en Desierto de Los Leones Olivar de Los Padres,"Olivar de los Padres, Alvaro Obregón","Departamento en venta en residencial bosque 6060. Estrena departamento de lujo con excelentes amenidades. 210m2 Construccion. 3 recamaras. 3. 5 baños. 3 estacionamientos. Mantenimiento $6, 000. Amenidades. Casa club con Alberca, Terraza, Jardin comun, Salon de eventos, Kids club, Cancha de tenis, Gym, Jacuzzi. EasyBroker id: eb-kw6480",/propiedades/departamento-en-desierto-de-los-leones-olivar-de-los-64531041.html,"MN 10,450,000",venta,3.0,3.0,210.0,210.0,3.0,1.0,
Departamento en Venta en Colonia del Valle,"Del Valle Centro, Benito Juárez","Un ambiente colonial, con gran oferta de escuelas, restaurantes, actividades recreativas y la tranquilidad que esta parte de la cdmx regala. El departamento se encuentra en el 3° nivel con elevador, cuenta con 99 m2 con excelente distribución entre dos niveles dejando en la planta baja una luminosa estancia con recibidor y cocina abierta con acceso al área de lavado y subiendo por las escaleras llegarás 1er. Nivel donde están 2 recámaras y 2 baños completos, este depa además cuenta con 1 cajón de estacionamiento. Su excelente ubicación te mantendrá conectado a todos los servicios ya que se encuentra próximo a Av. Insurgentes Sur, Av. División del Norte y Viaducto Miguel Alemán Valdés. A sus alrededores encontrarás: Plaza Metropoli Patriotismo, Pepsi Center wtc, Mi Mercado Lázaro Cárdenas y Walmart Express Del Valle Norte.",/propiedades/departamento-en-venta-en-colonia-del-valle-64383164.html,"MN 4,275,000",venta,2.0,2.0,100.0,,1.0,,
